{
  "sync_id": "SYNC-20260721-001",
  "sync_type": "manual",
  "status": "success",
  "stage": "completed",
  "is_existing_run": false,
  "requested_at": "2026-07-21T10:20:00+09:00",
  "started_at": "2026-07-21T10:20:01+09:00",
  "completed_at": "2026-07-21T10:20:14+09:00",
  "last_success_at": "2026-07-21T10:20:14+09:00",
  "next_scheduled_at": "2026-07-22T06:00:00+09:00",
  "collected_items": 5,
  "candidate_items": 4,
  "validated_items": 3,
  "rejected_items": 1,
  "published_items": 3,
  "new_items": 2,
  "updated_items": 1,
  "snapshot_updated": true,
  "published_snapshot_version": "issues-20260721T102014+0900",
  "published_at": "2026-07-21T10:20:14+09:00",
  "recalculation_triggered": true,
  "recalculation_status": "success",
  "recalculated_at": "2026-07-21T10:20:14+09:00",
  "failure_stage": null,
  "failed_sources": [],
  "data_status": "sample",
  "message": "새 이슈 2건과 상태 변경 1건을 후보 데이터에 반영했습니다.",
  "warnings": ["자동 검증을 통과하지 못한 후보 이벤트는 ESG 점수에 반영되지 않습니다."]
}
